{
  "$schema": "./sources.schema.json",
  "schema_version": 1,
  "pack_id": "org.open-workforce-index.office",
  "policy": {
    "unknown_provenance_is_allowed_in_development": true,
    "unknown_provenance_is_allowed_in_release": false,
    "notes": "A source record describes origin and rights evidence; it does not itself grant a license."
  },
  "records": [
    {
      "id": "source-bright-office-generation",
      "kind": "generative-tool",
      "description": "Generated as a 1672 by 941 background, then center-cropped to 1664 by 936, metadata-stripped, and downsampled to a WebP runtime rendition. OCR and visual review found no text, characters, logos, watermarks, or embedded data.",
      "created_at": null,
      "created_by": null,
      "tool": {
        "name": "image_gen__imagegen",
        "version": null,
        "terms_url": null,
        "terms_retrieved_at": null
      },
      "prompt": {
        "text": null,
        "file": "sources/prompts/bright-office.txt",
        "sha256": "76041c93e2896b6cb6351fd8a0fb02f582977a24b52e7a1f30116eb982d6f7a2"
      },
      "input_asset_ids": [],
      "source_urls": [],
      "output_asset_ids": [
        "background-bright-office-main"
      ],
      "artifacts": [
        {
          "role": "generated-master",
          "file": "sources/raw/bright-office-generated.png",
          "media_type": "image/png",
          "width_px": 1672,
          "height_px": 941,
          "has_alpha": false,
          "byte_size": 1846670,
          "sha256": "2d3ce60f25a65fb2fc48ef8203993814133047d8326c84074f5d4a354939a3ba"
        },
        {
          "role": "processed-master",
          "file": "backgrounds/bright-office.png",
          "media_type": "image/png",
          "width_px": 1664,
          "height_px": 936,
          "has_alpha": false,
          "byte_size": 1778829,
          "sha256": "9034711e3831ab46818da70e6cc7c10caaa9bd743febb0f03d73474ff0936549"
        },
        {
          "role": "runtime-output",
          "file": "backgrounds/bright-office.webp",
          "media_type": "image/webp",
          "width_px": 1280,
          "height_px": 720,
          "has_alpha": false,
          "byte_size": 48364,
          "sha256": "b899af49ab403951759b167ff167ed47073b5661d5e9173fcd997fded00ea1f6"
        }
      ],
      "rights": {
        "status": "pending",
        "owner": null,
        "license_expression": null,
        "evidence_urls": [],
        "reviewed_by": null,
        "reviewed_at": null,
        "notes": "Technical and visual review is complete. No legal or rights review has been recorded."
      }
    },
    {
      "id": "source-orbit-generation",
      "kind": "generative-tool",
      "description": "Generated on a chroma-key brief, normalized to an exact flat chroma master, converted to a transparent PNG with border auto-key, soft matte, thresholds 12 and 220, and despill, then downsampled to a transparent WebP runtime rendition. Border, alpha, coverage, and green-fringe technical checks passed.",
      "created_at": null,
      "created_by": null,
      "tool": {
        "name": "image_gen__imagegen",
        "version": null,
        "terms_url": null,
        "terms_retrieved_at": null
      },
      "prompt": {
        "text": null,
        "file": "sources/prompts/orbit.txt",
        "sha256": "c6d424ef6fbd7094e9983aa9d475b2b728c4cc1730b26ebd3667fedff00ae2ba"
      },
      "input_asset_ids": [],
      "source_urls": [],
      "output_asset_ids": [
        "character-orbit-dispatcher-idle"
      ],
      "artifacts": [
        {
          "role": "generated-master",
          "file": "characters/sources/raw/orbit-generated.png",
          "media_type": "image/png",
          "width_px": 1254,
          "height_px": 1254,
          "has_alpha": false,
          "byte_size": 1416097,
          "sha256": "844d9fb39c6f256b0f6e367694b867166678722f663ca0e8fb0a548004cd8439"
        },
        {
          "role": "intermediate",
          "file": "characters/sources/orbit-chroma.png",
          "media_type": "image/png",
          "width_px": 1254,
          "height_px": 1254,
          "has_alpha": false,
          "byte_size": 724572,
          "sha256": "4005d622e2d96d0e5e5ed5130355688d11daba6746efbe3bcccf31833fb8068f"
        },
        {
          "role": "processed-master",
          "file": "characters/orbit.png",
          "media_type": "image/png",
          "width_px": 1254,
          "height_px": 1254,
          "has_alpha": true,
          "byte_size": 837782,
          "sha256": "64d58e7cb2364db6f03400606c29d1f1ae1e9bb6b21a2036d11976fa4e304ae1"
        },
        {
          "role": "runtime-output",
          "file": "characters/orbit.webp",
          "media_type": "image/webp",
          "width_px": 640,
          "height_px": 640,
          "has_alpha": true,
          "byte_size": 30706,
          "sha256": "4ddcf7641b9eb6c40c1b30cfdd8b0ba603ce4666325b9e71cd6be5aea3c761d4"
        }
      ],
      "rights": {
        "status": "pending",
        "owner": null,
        "license_expression": null,
        "evidence_urls": [],
        "reviewed_by": null,
        "reviewed_at": null,
        "notes": "Technical and visual review is complete. No legal or rights review has been recorded."
      }
    },
    {
      "id": "source-nova-generation",
      "kind": "generative-tool",
      "description": "Generated on a chroma-key brief, normalized to an exact flat chroma master, converted to a transparent PNG with border auto-key, soft matte, thresholds 12 and 220, and despill, then downsampled to a transparent WebP runtime rendition. Border, alpha, coverage, and green-fringe technical checks passed.",
      "created_at": null,
      "created_by": null,
      "tool": {
        "name": "image_gen__imagegen",
        "version": null,
        "terms_url": null,
        "terms_retrieved_at": null
      },
      "prompt": {
        "text": null,
        "file": "sources/prompts/nova.txt",
        "sha256": "e2b368d2ce3a57e7490c0a310db7ad46594b8692ba545a8cdcc4e03343d5ad0a"
      },
      "input_asset_ids": [],
      "source_urls": [],
      "output_asset_ids": [
        "character-nova-researcher-idle"
      ],
      "artifacts": [
        {
          "role": "generated-master",
          "file": "characters/sources/raw/nova-generated.png",
          "media_type": "image/png",
          "width_px": 1254,
          "height_px": 1254,
          "has_alpha": false,
          "byte_size": 1269602,
          "sha256": "6fcb32a09a419589a230154038e457c3d1f0ac87f1bd0f7f9a559b78900bb62a"
        },
        {
          "role": "intermediate",
          "file": "characters/sources/nova-chroma.png",
          "media_type": "image/png",
          "width_px": 1254,
          "height_px": 1254,
          "has_alpha": false,
          "byte_size": 438717,
          "sha256": "28a2f9f34a27667cb79b7c9e02ca8a02bf364d27952209ce778baf6bee86671a"
        },
        {
          "role": "processed-master",
          "file": "characters/nova.png",
          "media_type": "image/png",
          "width_px": 1254,
          "height_px": 1254,
          "has_alpha": true,
          "byte_size": 510201,
          "sha256": "f8b850c21f5b7616ea004c114a2a811b5fe3eaa5be2dcc44afc03401881dc3b4"
        },
        {
          "role": "runtime-output",
          "file": "characters/nova.webp",
          "media_type": "image/webp",
          "width_px": 640,
          "height_px": 640,
          "has_alpha": true,
          "byte_size": 18332,
          "sha256": "7ba869ee5fd0913878d4b2711233007d12290d37d9193bc6fb8323e7545f68fd"
        }
      ],
      "rights": {
        "status": "pending",
        "owner": null,
        "license_expression": null,
        "evidence_urls": [],
        "reviewed_by": null,
        "reviewed_at": null,
        "notes": "Technical and visual review is complete. No legal or rights review has been recorded."
      }
    },
    {
      "id": "source-mira-generation",
      "kind": "generative-tool",
      "description": "Generated on a chroma-key brief, normalized to an exact flat chroma master, converted to a transparent PNG with border auto-key, soft matte, thresholds 12 and 220, and despill, then downsampled to a transparent WebP runtime rendition. Border, alpha, coverage, and green-fringe technical checks passed.",
      "created_at": null,
      "created_by": null,
      "tool": {
        "name": "image_gen__imagegen",
        "version": null,
        "terms_url": null,
        "terms_retrieved_at": null
      },
      "prompt": {
        "text": null,
        "file": "sources/prompts/mira.txt",
        "sha256": "39c1654672d94cf4a2e6736ab35d2f240704597ddc406a75add8f6bff8090cb6"
      },
      "input_asset_ids": [],
      "source_urls": [],
      "output_asset_ids": [
        "character-mira-designer-idle"
      ],
      "artifacts": [
        {
          "role": "generated-master",
          "file": "characters/sources/raw/mira-generated.png",
          "media_type": "image/png",
          "width_px": 1254,
          "height_px": 1254,
          "has_alpha": false,
          "byte_size": 1211935,
          "sha256": "f08ccd73d3da0b377740562cf98ef1f483809d2adf0eff753a9c0c7057745476"
        },
        {
          "role": "intermediate",
          "file": "characters/sources/mira-chroma.png",
          "media_type": "image/png",
          "width_px": 1254,
          "height_px": 1254,
          "has_alpha": false,
          "byte_size": 369288,
          "sha256": "f3b1653c19664e095e9f5cbd7e0d8b2d45188cbfed5cc838a60da69e566a291f"
        },
        {
          "role": "processed-master",
          "file": "characters/mira.png",
          "media_type": "image/png",
          "width_px": 1254,
          "height_px": 1254,
          "has_alpha": true,
          "byte_size": 434839,
          "sha256": "7a22e1046328c71a51a7782314a9f82cca2d4b6c5479c5221c3ffeeaf537294e"
        },
        {
          "role": "runtime-output",